{
  "pair": "USDT/CNY",
  "bid": 6.7826069,
  "ask": 6.8503,
  "mid": 6.81645345,
  "asof_ts": 1777559726,
  "asof_iso": "2026-04-30T14:35:26Z",
  "timezone": "UTC",
  "source": "okx_p2p",
  "bid_source": "okx_p2p",
  "ask_source": "okx_p2p",
  "source_pool": [
    "okx_p2p"
  ],
  "source_count": 1,
  "sample_count": 145,
  "sample_count_bid": 145,
  "sample_count_ask": 160,
  "dispersion": 0.00099098,
  "dispersion_bid": 0.00099189,
  "dispersion_ask": 0.00099008,
  "quality_score": 95.3,
  "quality_score_bid": 95.0,
  "quality_score_ask": 95.6,
  "calc_version": "rt_v4_bidask",
  "input_hash": "9d0c881fa9ad1ba08b6866bb538297b42e361f59c7533ab07197c70ee46de855",
  "generated_at": "2026-04-30T14:35:26Z"
}
